{
  "channel": "meeting-q2-review",
  "clientId": "usr_5d11",
  "connectionId": "conn_5d11_02",
  "action": "enter",
  "data": {
    "displayName": "Dana",
    "avatarUrl": "https://cdn.acme.example/avatars/usr_5d11.png",
    "role": "host",
    "device": "macOS-Chrome"
  },
  "since": "2026-05-22T15:00:12Z",
  "occurredAt": "2026-05-22T15:00:12.341Z"
}
